{"$schema":"https://json-schema.org/draft/2020-12/schema","type":"object","properties":{"schemaVersion":{"type":"string","const":"worldforge/0.1"},"project":{"type":"object","properties":{"id":{"$ref":"#/$defs/__schema0"},"name":{"type":"string","minLength":1},"template":{"type":"string","minLength":1},"extensions":{"type":"array","items":{"type":"string","minLength":1}},"metadata":{"$ref":"#/$defs/__schema1"}},"required":["id","name"],"additionalProperties":false},"world":{"type":"object","properties":{"id":{"$ref":"#/$defs/__schema0"},"name":{"type":"string","minLength":1},"units":{"type":"string","const":"meter"},"upAxis":{"type":"string","const":"Y"},"handedness":{"type":"string","const":"right"},"geoAnchor":{"type":"object","properties":{"latitude":{"type":"number","minimum":-90,"maximum":90},"longitude":{"type":"number","minimum":-180,"maximum":180},"altitude":{"type":"number"}},"required":["latitude","longitude"],"additionalProperties":false},"metadata":{"$ref":"#/$defs/__schema1"}},"required":["id","name","units","upAxis","handedness"],"additionalProperties":false},"assets":{"type":"array","items":{"type":"object","properties":{"id":{"$ref":"#/$defs/__schema0"},"type":{"type":"string","enum":["model","texture","audio","animation","data","other"]},"uri":{"type":"string","minLength":1},"metadata":{"$ref":"#/$defs/__schema1"}},"required":["id","type","uri"],"additionalProperties":false}},"zones":{"type":"array","items":{"type":"object","properties":{"id":{"$ref":"#/$defs/__schema0"},"name":{"type":"string","minLength":1},"type":{"$ref":"#/$defs/__schema3"},"geometry":{"type":"object","properties":{"type":{"type":"string","const":"polygon"},"space":{"type":"string","const":"local"},"points":{"minItems":3,"type":"array","items":{"$ref":"#/$defs/__schema4"}}},"required":["type","space","points"],"additionalProperties":false},"tags":{"type":"array","items":{"type":"string"}},"metadata":{"$ref":"#/$defs/__schema1"}},"required":["id","name","type","geometry"],"additionalProperties":false}},"places":{"type":"array","items":{"type":"object","properties":{"id":{"$ref":"#/$defs/__schema0"},"name":{"type":"string","minLength":1},"type":{"$ref":"#/$defs/__schema3"},"zoneId":{"$ref":"#/$defs/__schema0"},"position":{"$ref":"#/$defs/__schema5"},"tags":{"type":"array","items":{"type":"string"}},"metadata":{"$ref":"#/$defs/__schema1"}},"required":["id","name","type","position"],"additionalProperties":false}},"paths":{"type":"array","items":{"type":"object","properties":{"id":{"$ref":"#/$defs/__schema0"},"name":{"type":"string","minLength":1},"type":{"$ref":"#/$defs/__schema3"},"from":{"$ref":"#/$defs/__schema0"},"to":{"$ref":"#/$defs/__schema0"},"points":{"minItems":2,"type":"array","items":{"$ref":"#/$defs/__schema5"}},"modes":{"minItems":1,"type":"array","items":{"$ref":"#/$defs/__schema6"}},"oneWay":{"type":"boolean"},"enabled":{"type":"boolean"},"widthMeters":{"type":"number","exclusiveMinimum":0},"tags":{"type":"array","items":{"type":"string"}},"metadata":{"$ref":"#/$defs/__schema1"}},"required":["id","type","points","modes","oneWay","enabled"],"additionalProperties":false}},"entities":{"type":"array","items":{"type":"object","properties":{"id":{"$ref":"#/$defs/__schema0"},"name":{"type":"string","minLength":1},"type":{"$ref":"#/$defs/__schema3"},"parentId":{"anyOf":[{"$ref":"#/$defs/__schema0"},{"type":"null"}]},"enabled":{"type":"boolean"},"transform":{"type":"object","properties":{"position":{"$ref":"#/$defs/__schema5"},"rotation":{"type":"array","prefixItems":[{"type":"number"},{"type":"number"},{"type":"number"},{"type":"number"}],"items":false,"minItems":4,"maxItems":4},"scale":{"type":"array","prefixItems":[{"type":"number","exclusiveMinimum":0},{"type":"number","exclusiveMinimum":0},{"type":"number","exclusiveMinimum":0}],"items":false,"minItems":3,"maxItems":3}},"required":["position","rotation","scale"],"additionalProperties":false},"assetId":{"$ref":"#/$defs/__schema0"},"tags":{"type":"array","items":{"type":"string"}},"components":{"type":"object","propertyNames":{"$ref":"#/$defs/__schema3"},"additionalProperties":{"$ref":"#/$defs/__schema2"}},"metadata":{"$ref":"#/$defs/__schema1"}},"required":["id","name","type","parentId","enabled","transform","tags","components"],"additionalProperties":false}},"npcs":{"type":"array","items":{"type":"object","properties":{"id":{"$ref":"#/$defs/__schema0"},"name":{"type":"string","minLength":1},"entityId":{"$ref":"#/$defs/__schema0"},"profile":{"type":"object","properties":{"role":{"type":"string","minLength":1},"affiliation":{"type":"string","minLength":1},"attributes":{"$ref":"#/$defs/__schema1"}},"additionalProperties":false},"homePlaceId":{"$ref":"#/$defs/__schema0"},"schedule":{"type":"array","items":{"type":"object","properties":{"start":{"type":"string","pattern":"^([01]\\d|2[0-3]):[0-5]\\d$"},"end":{"type":"string","pattern":"^([01]\\d|2[0-3]):[0-5]\\d$"},"action":{"type":"string","minLength":1},"target":{"$ref":"#/$defs/__schema0"},"params":{"$ref":"#/$defs/__schema1"}},"required":["start","end","action"],"additionalProperties":false}},"behavior":{"type":"object","properties":{"movement":{"type":"string","minLength":1},"interaction":{"type":"string","minLength":1},"params":{"$ref":"#/$defs/__schema1"}},"additionalProperties":false},"metadata":{"$ref":"#/$defs/__schema1"}},"required":["id","profile","schedule"],"additionalProperties":false}},"quests":{"type":"array","items":{"type":"object","properties":{"id":{"$ref":"#/$defs/__schema0"},"name":{"type":"string","minLength":1},"type":{"$ref":"#/$defs/__schema3"},"nodes":{"minItems":1,"type":"array","items":{"$ref":"#/$defs/__schema7"}},"edges":{"type":"array","items":{"type":"object","properties":{"from":{"$ref":"#/$defs/__schema0"},"to":{"$ref":"#/$defs/__schema0"},"condition":{"$ref":"#/$defs/__schema1"}},"required":["from","to"],"additionalProperties":false}},"metadata":{"$ref":"#/$defs/__schema1"}},"required":["id","name","type","nodes","edges"],"additionalProperties":false}},"events":{"type":"array","items":{"type":"object","properties":{"id":{"$ref":"#/$defs/__schema0"},"name":{"type":"string","minLength":1},"startsAt":{"type":"string","minLength":1},"endsAt":{"type":"string","minLength":1},"overrides":{"type":"array","items":{"type":"object","properties":{"operation":{"type":"string","enum":["spawn","update","remove","enable","disable"]},"targetType":{"$ref":"#/$defs/__schema3"},"targetId":{"$ref":"#/$defs/__schema0"},"payload":{"$ref":"#/$defs/__schema2"}},"required":["operation","targetType","targetId"],"additionalProperties":false}},"cleanup":{"type":"object","properties":{"mode":{"type":"string","enum":["automatic","manual"]},"targets":{"type":"array","items":{"$ref":"#/$defs/__schema0"}}},"required":["mode"],"additionalProperties":false},"metadata":{"$ref":"#/$defs/__schema1"}},"required":["id","name","startsAt","endsAt","overrides","cleanup"],"additionalProperties":false}},"rules":{"type":"array","items":{"type":"object","properties":{"id":{"$ref":"#/$defs/__schema0"},"type":{"$ref":"#/$defs/__schema3"},"enabled":{"type":"boolean"},"config":{"$ref":"#/$defs/__schema1"},"metadata":{"$ref":"#/$defs/__schema1"}},"required":["id","type","enabled","config"],"additionalProperties":false}},"metadata":{"$ref":"#/$defs/__schema1"}},"required":["schemaVersion","project","world","assets","zones","places","paths","entities","npcs","quests","events","rules"],"additionalProperties":false,"$defs":{"__schema0":{"type":"string","minLength":1,"pattern":"^[A-Za-z0-9][A-Za-z0-9._:/-]*$"},"__schema1":{"type":"object","propertyNames":{"type":"string"},"additionalProperties":{"$ref":"#/$defs/__schema2"}},"__schema2":{"anyOf":[{"type":"string"},{"type":"number"},{"type":"boolean"},{"type":"null"},{"type":"array","items":{"$ref":"#/$defs/__schema2"}},{"type":"object","propertyNames":{"type":"string"},"additionalProperties":{"$ref":"#/$defs/__schema2"}}]},"__schema3":{"type":"string","pattern":"^[a-z][a-z0-9-]*(?:\\.[A-Za-z][A-Za-z0-9-]*)+$"},"__schema4":{"type":"array","prefixItems":[{"type":"number"},{"type":"number"}],"items":false,"minItems":2,"maxItems":2},"__schema5":{"type":"array","prefixItems":[{"type":"number"},{"type":"number"},{"type":"number"}],"items":false,"minItems":3,"maxItems":3},"__schema6":{"type":"string","enum":["walk","vehicle","wheelchair","npc"]},"__schema7":{"type":"object","properties":{"id":{"$ref":"#/$defs/__schema0"},"type":{"$ref":"#/$defs/__schema3"},"params":{"$ref":"#/$defs/__schema1"}},"required":["id","type"],"additionalProperties":false}},"$id":"https://worldforge.dev/schema/0.1/world-manifest.schema.json","title":"WorldForge World Manifest v0.1"}
